<?xml version="1.0" encoding="UTF-8" ?>
<configuracion xmlns:xsi="http://www.w3.org/2001/XMLSchema-instance" xsi:noNamespaceSchemaLocation="config.xsd" >
	<puertoBD>3306</puertoBD>
	<driverBD>com.mysql.jdbc.Driver</driverBD>
	<userBD>root</userBD>
	<passBD>root</passBD>
	<fuenteDatos>cararural2011</fuenteDatos>
	<serverBD>localhost</serverBD>
	<protocoloBD>jdbc:mysql</protocoloBD>
	<serverRMI>localhost</serverRMI>
	<puertoRMI>1099</puertoRMI>
	<servicioRMI>CasaRural2011</servicioRMI>
	<ficheroReservas>numeroReserva.txt</ficheroReservas>
</configuracion>
